{
  "schemaVersion": 1,
  "skillCatalogVersion": "0.2.0",
  "rubricSetVersion": "0.2.0",
  "mapId": "attribution.mvp-core",
  "mapVersion": 1,
  "status": "draft",
  "entries": [
    {
      "caseId": "python-config-precedence-001",
      "caseVersion": 1,
      "nodeId": "python-config-precedence-001-node-01",
      "leafSkillId": "eng.runtime-debugging",
      "rubricVersion": 1,
      "role": "primary",
      "evidenceType": "diagnosis",
      "rationale": "The first scored node directly exercises Runtime Debugging.",
      "reviewer": "mvp.content-review"
    },
    {
      "caseId": "python-config-precedence-001",
      "caseVersion": 1,
      "nodeId": "python-config-precedence-001-node-01",
      "leafSkillId": "eng.python-engineering",
      "rubricVersion": 1,
      "role": "secondary",
      "evidenceType": "code-review",
      "rationale": "The node provides supporting evidence for Python Engineering.",
      "reviewer": "mvp.content-review"
    },
    {
      "caseId": "linux-systemd-runtime-path-001",
      "caseVersion": 1,
      "nodeId": "linux-systemd-runtime-path-001-node-01",
      "leafSkillId": "eng.runtime-debugging",
      "rubricVersion": 1,
      "role": "primary",
      "evidenceType": "diagnosis",
      "rationale": "The first scored node directly exercises Runtime Debugging.",
      "reviewer": "mvp.content-review"
    },
    {
      "caseId": "linux-systemd-runtime-path-001",
      "caseVersion": 1,
      "nodeId": "linux-systemd-runtime-path-001-node-01",
      "leafSkillId": "eng.python-engineering",
      "rubricVersion": 1,
      "role": "secondary",
      "evidenceType": "code-review",
      "rationale": "The node provides supporting evidence for Python Engineering.",
      "reviewer": "mvp.content-review"
    },
    {
      "caseId": "api-error-contract-version-drift-001",
      "caseVersion": 1,
      "nodeId": "api-error-contract-version-drift-001-node-01",
      "leafSkillId": "software.api-design",
      "rubricVersion": 1,
      "role": "primary",
      "evidenceType": "api-contract",
      "rationale": "The first scored node directly exercises API Design.",
      "reviewer": "mvp.content-review"
    },
    {
      "caseId": "api-error-contract-version-drift-001",
      "caseVersion": 1,
      "nodeId": "api-error-contract-version-drift-001-node-01",
      "leafSkillId": "eng.automated-testing",
      "rubricVersion": 1,
      "role": "secondary",
      "evidenceType": "test-plan",
      "rationale": "The node provides supporting evidence for Automated Testing.",
      "reviewer": "mvp.content-review"
    },
    {
      "caseId": "api-timeout-budget-cascade-001",
      "caseVersion": 1,
      "nodeId": "api-timeout-budget-cascade-001-node-01",
      "leafSkillId": "software.distributed-reliability",
      "rubricVersion": 1,
      "role": "primary",
      "evidenceType": "reliability-plan",
      "rationale": "The first scored node directly exercises Distributed Reliability.",
      "reviewer": "mvp.content-review"
    },
    {
      "caseId": "api-timeout-budget-cascade-001",
      "caseVersion": 1,
      "nodeId": "api-timeout-budget-cascade-001-node-01",
      "leafSkillId": "prod.reliability",
      "rubricVersion": 1,
      "role": "secondary",
      "evidenceType": "reliability-plan",
      "rationale": "The node provides supporting evidence for Reliability Engineering.",
      "reviewer": "mvp.content-review"
    },
    {
      "caseId": "api-webhook-idempotency-001",
      "caseVersion": 2,
      "nodeId": "api-webhook-idempotency-001-node-01",
      "leafSkillId": "software.backend-architecture",
      "rubricVersion": 1,
      "role": "primary",
      "evidenceType": "architecture-decision",
      "rationale": "The first scored node directly exercises Backend Architecture.",
      "reviewer": "mvp.content-review"
    },
    {
      "caseId": "api-webhook-idempotency-001",
      "caseVersion": 2,
      "nodeId": "api-webhook-idempotency-001-node-01",
      "leafSkillId": "software.api-design",
      "rubricVersion": 1,
      "role": "secondary",
      "evidenceType": "api-contract",
      "rationale": "The node provides supporting evidence for API Design.",
      "reviewer": "mvp.content-review"
    },
    {
      "caseId": "api-webhook-idempotency-001",
      "caseVersion": 2,
      "nodeId": "api-webhook-idempotency-001-node-01",
      "leafSkillId": "software.distributed-reliability",
      "rubricVersion": 1,
      "role": "secondary",
      "evidenceType": "reliability-plan",
      "rationale": "The node provides supporting evidence for Distributed Reliability.",
      "reviewer": "mvp.content-review"
    },
    {
      "caseId": "llm-prompt-context-order-001",
      "caseVersion": 1,
      "nodeId": "llm-prompt-context-order-001-node-01",
      "leafSkillId": "ai.prompt-engineering",
      "rubricVersion": 1,
      "role": "primary",
      "evidenceType": "prompt-decision",
      "rationale": "The first scored node directly exercises Prompt Engineering.",
      "reviewer": "mvp.content-review"
    },
    {
      "caseId": "llm-prompt-context-order-001",
      "caseVersion": 1,
      "nodeId": "llm-prompt-context-order-001-node-01",
      "leafSkillId": "ai.llm-application",
      "rubricVersion": 1,
      "role": "secondary",
      "evidenceType": "feature-decision",
      "rationale": "The node provides supporting evidence for LLM Application Engineering.",
      "reviewer": "mvp.content-review"
    },
    {
      "caseId": "llm-eval-dataset-leakage-001",
      "caseVersion": 1,
      "nodeId": "llm-eval-dataset-leakage-001-node-01",
      "leafSkillId": "ai.llm-evaluation",
      "rubricVersion": 1,
      "role": "primary",
      "evidenceType": "evaluation-report",
      "rationale": "The first scored node directly exercises LLM Evaluation.",
      "reviewer": "mvp.content-review"
    },
    {
      "caseId": "llm-eval-dataset-leakage-001",
      "caseVersion": 1,
      "nodeId": "llm-eval-dataset-leakage-001-node-01",
      "leafSkillId": "eng.automated-testing",
      "rubricVersion": 1,
      "role": "secondary",
      "evidenceType": "test-plan",
      "rationale": "The node provides supporting evidence for Automated Testing.",
      "reviewer": "mvp.content-review"
    },
    {
      "caseId": "llm-cost-routing-quality-regression-001",
      "caseVersion": 1,
      "nodeId": "llm-cost-routing-quality-regression-001-node-01",
      "leafSkillId": "prod.cost-optimization",
      "rubricVersion": 1,
      "role": "primary",
      "evidenceType": "cost-analysis",
      "rationale": "The first scored node directly exercises AI Cost Optimization.",
      "reviewer": "mvp.content-review"
    },
    {
      "caseId": "llm-cost-routing-quality-regression-001",
      "caseVersion": 1,
      "nodeId": "llm-cost-routing-quality-regression-001-node-01",
      "leafSkillId": "ai.model-selection",
      "rubricVersion": 1,
      "role": "secondary",
      "evidenceType": "model-adr",
      "rationale": "The node provides supporting evidence for Model Selection.",
      "reviewer": "mvp.content-review"
    },
    {
      "caseId": "llm-cost-routing-quality-regression-001",
      "caseVersion": 1,
      "nodeId": "llm-cost-routing-quality-regression-001-node-01",
      "leafSkillId": "ai.llm-evaluation",
      "rubricVersion": 1,
      "role": "secondary",
      "evidenceType": "evaluation-report",
      "rationale": "The node provides supporting evidence for LLM Evaluation.",
      "reviewer": "mvp.content-review"
    },
    {
      "caseId": "rag-chunk-boundary-answer-loss-001",
      "caseVersion": 1,
      "nodeId": "rag-chunk-boundary-answer-loss-001-node-01",
      "leafSkillId": "rag.chunking",
      "rubricVersion": 1,
      "role": "primary",
      "evidenceType": "chunking-decision",
      "rationale": "The first scored node directly exercises RAG Chunking.",
      "reviewer": "mvp.content-review"
    },
    {
      "caseId": "rag-chunk-boundary-answer-loss-001",
      "caseVersion": 1,
      "nodeId": "rag-chunk-boundary-answer-loss-001-node-01",
      "leafSkillId": "rag.retrieval",
      "rubricVersion": 1,
      "role": "secondary",
      "evidenceType": "retrieval-report",
      "rationale": "The node provides supporting evidence for RAG Retrieval.",
      "reviewer": "mvp.content-review"
    },
    {
      "caseId": "rag-top-k-context-dilution-001",
      "caseVersion": 1,
      "nodeId": "rag-top-k-context-dilution-001-node-01",
      "leafSkillId": "rag.retrieval",
      "rubricVersion": 1,
      "role": "primary",
      "evidenceType": "retrieval-report",
      "rationale": "The first scored node directly exercises RAG Retrieval.",
      "reviewer": "mvp.content-review"
    },
    {
      "caseId": "rag-top-k-context-dilution-001",
      "caseVersion": 1,
      "nodeId": "rag-top-k-context-dilution-001-node-01",
      "leafSkillId": "rag.evaluation",
      "rubricVersion": 1,
      "role": "secondary",
      "evidenceType": "rag-evaluation",
      "rationale": "The node provides supporting evidence for RAG Evaluation.",
      "reviewer": "mvp.content-review"
    },
    {
      "caseId": "rag-permission-filter-gap-001",
      "caseVersion": 1,
      "nodeId": "rag-permission-filter-gap-001-node-01",
      "leafSkillId": "prod.security",
      "rubricVersion": 1,
      "role": "primary",
      "evidenceType": "security-review",
      "rationale": "The first scored node directly exercises Security Engineering.",
      "reviewer": "mvp.content-review"
    },
    {
      "caseId": "rag-permission-filter-gap-001",
      "caseVersion": 1,
      "nodeId": "rag-permission-filter-gap-001-node-01",
      "leafSkillId": "rag.retrieval",
      "rubricVersion": 1,
      "role": "secondary",
      "evidenceType": "retrieval-report",
      "rationale": "The node provides supporting evidence for RAG Retrieval.",
      "reviewer": "mvp.content-review"
    },
    {
      "caseId": "rag-permission-filter-gap-001",
      "caseVersion": 1,